{
    "data": {
        "add_investor": {
            "component_code": "INVESTOR_ADD",
            "is_active": true,
            "is_show": true,
            "title": "Investor",
            "url": "/advisor/onboarding/"
        },
        "disclosures": [
            {
                "text": "Risk assessment is a set of multi-choice questions, answers to which help us understand your disposition towards the risk of loss in your investments. Your inputs help us tailor our investment advice to your risk appetite. It has to be done separately for each investor you add to your account.",
                "title": "Statutory Disclosures"
            }
        ],
        "disclosures_data": {
            "data": [
                {
                    "details": {"list": [
                        {"data_fmt": "Ashutosh Gupta", "name": "Name"},
                        {"data_fmt": "principalofficer@valueresearch.in", "name": "Email"},
                        {"data_fmt": 9711400789, "name": "Mobile Number"}
                    ]},
                    "title": "Principal Officer"
                },
                {
                    "details": {"list": [
                        {"data_fmt": "Rahul Rastogi", "name": "Name"},
                        {"data_fmt": "compliance@valueresearch.in", "name": "Email"},
                        {"data_fmt": 8595521812, "name": "Mobile Number"}
                    ]},
                    "title": "Compliance Officer"
                },
                {
                    "details": {"list": [
                        {"data_fmt": "Deepa Mandhani", "name": "Name"},
                        {"data_fmt": "grievanceofficer@valueresearch.in", "name": "Email"},
                        {"data_fmt": 9999322422, "name": "Mobile Number"}
                    ]},
                    "title": "Grievance Officer"
                },
                {
                    "details": {"desc": "Investment in securities market are subject to market risks. Read all the related documents carefully before investing."},
                    "title": "Warning"
                },
                {
                    "details": {"desc": "<p> Independent Advisors Private Limited<br>C-103, Sector 65, Noida, Gautam Buddha Nagar, Uttar Pradesh, 201301</p>"},
                    "title": "Correspondence Address"
                },
                {
                    "details": {"desc": "<p> Independent Advisors Private Limited<br> 5, DDA Commercial Complex, Chitra Vihar, New Delhi - 110092</p>"},
                    "title": "Registered Office"
                },
                {
                    "details": {"desc": "Registration granted by SEBI, enlistment as IA with Exchange and certification from National Institute of Securities Markets (NISM) in no way guarantee performance of the intermediary or provide any assurance of returns to investors"},
                    "title": "Disclaimer"
                },
                {
                    "details": {"desc": "&copy; 2026 Independent Advisors Private Limited, All Rights Reserved<br>SEBI Registration No: INA100008443 | BSE enlistment No: 1201 | CIN: U74140DL2022PTC399760 | SEBI local office address: NBCC Complex, Office Tower-1, 8th Floor, Plate B, East Kidwai Nagar, New Delhi - 110023. Type of Registration: Non-Individual. Validity of registration: 14 September, 2017 - Perpetual"}
                }
            ]
        },
        "hub": [
            {
                "id": "profile",
                "menus": [
                    {"action_hint": "View and edit your account details", "component_code": null, "download_url": null, "icon": "/assets/images/hub_icon/account_details.svg", "id": "account_details", "is_ext_url": false, "products": null, "title": "Account Details", "url": "/myaccount/"},
                    {"action_hint": "View your subscription details", "component_code": null, "download_url": null, "icon": "/assets/images/hub_icon/subscription_details.svg", "id": "subscription_details", "is_ext_url": false, "products": null, "title": "Subscription Details", "url": "/mysubscription/"},
                    {"action_hint": "Manage your portfolio settings", "component_code": null, "download_url": null, "icon": "/assets/images/hub_icon/portfolio_settings.svg", "id": "portfolio_settings", "is_ext_url": false, "products": null, "title": "Portfolio Settings", "url": "/settings/#portfolio"},
                    {"action_hint": "Manage your app settings", "component_code": null, "download_url": null, "icon": "/assets/images/hub_icon/app_settings.svg", "id": "app_settings", "is_ext_url": false, "products": null, "title": "App Settings", "url": "/settings/#app"}
                ],
                "title": "Profile"
            },
            {
                "id": "investor_account",
                "menus": [
                    {"action_hint": "View basic investor details and KYC related actions", "component_code": "MY_INVESTOR_ACCOUNT_PAGE", "download_url": null, "icon": "/assets/images/hub_icon/basic_details.svg", "id": "basic_details", "is_ext_url": false, "products": null, "title": "Basic Details", "url": "/my-investor-account/#basic-details"},
                    {"action_hint": "View your bank details", "component_code": "MY_INVESTOR_ACCOUNT_PAGE", "download_url": null, "icon": "/assets/images/hub_icon/bank_details.svg", "id": "bank_details", "is_ext_url": false, "products": null, "title": "Bank Details", "url": "/my-investor-account/#bank-details"},
                    {"action_hint": "View your autopay mandates details", "component_code": "MY_INVESTOR_ACCOUNT_PAGE", "download_url": null, "icon": "/assets/images/hub_icon/autopay_mandate.svg", "id": "autopay_mandate", "is_ext_url": false, "products": null, "title": "Autopay Mandate", "url": "/my-investor-account/#mandate"},
                    {"action_hint": "View your nominees details", "component_code": "MY_INVESTOR_ACCOUNT_PAGE", "download_url": null, "icon": "/assets/images/hub_icon/nominee.svg", "id": "nominee", "is_ext_url": false, "products": null, "title": "Nominees", "url": "/my-investor-account/#nominee"},
                    {"action_hint": "View your risk assessment results", "component_code": "RISK_ASSESSMENT_PAGE", "download_url": null, "icon": "/assets/images/hub_icon/risk_assessment.svg", "id": "risk_assessment", "is_ext_url": false, "products": null, "title": "Risk Assessment", "url": "/my-investor-account/#risk_assessment"},
                    {"action_hint": "Open portfolio analysis screen", "component_code": null, "download_url": null, "icon": "/assets/images/hub_icon/portfolio_analysis.svg", "id": "portfolio_analysis", "is_ext_url": false, "products": null, "title": "Portfolio Analysis", "url": "/portfolio/analysis/"},
                    {"action_hint": "Manage your SIPs and SWPs", "component_code": "MANAGE_SYS_INVESTMENTS_PAGE", "download_url": null, "icon": "/assets/images/hub_icon/your_sip_swp.svg", "id": "your_sip_swp", "is_ext_url": false, "products": null, "title": "Your SIPs/SWPs", "url": "/portfolio/manage-systematic-investments/"},
                    {"action_hint": "View your orders", "component_code": "PORTFOLIO_YOUR_ORDERS_PAGE", "download_url": null, "icon": "/assets/images/hub_icon/your_order.svg", "id": "your_order", "is_ext_url": false, "products": null, "title": "Your Orders", "url": "/portfolio/orders/"},
                    {"action_hint": "View all your transactions", "component_code": null, "download_url": null, "icon": "/assets/images/hub_icon/all_transaction.svg", "id": "all_transaction", "is_ext_url": false, "products": null, "title": "All Transactions", "url": "/portfolio/transactions/"}
                ],
                "title": "Investor Accounts"
            },
            {
                "id": "mutual_funds",
                "menus": [
                    {"action_hint": "Open portfolio planner screen", "component_code": "PORTFOLIO_PLANNER_PAGE", "download_url": null, "icon": "/assets/images/hub_icon/portfolio_planner.svg", "id": "portfolio_planner", "is_ext_url": false, "products": null, "title": "Portfolio Planner", "url": "/portfolio-planner/"},
                    {"action_hint": "Open Analyst's Choice screen", "component_code": "FUND_ANALYSTS_CHOICE_PAGE", "download_url": null, "icon": "/assets/images/hub_icon/analyst_choice.svg", "id": "analyst_choice", "is_ext_url": false, "products": null, "title": "Analyst’s Choice", "url": "/funds/analysts-choice/"},
                    {"action_hint": "Open Fund Screener screen", "component_code": null, "download_url": null, "icon": "/assets/images/hub_icon/fund_screener.svg", "id": "fund_screener", "is_ext_url": false, "products": null, "title": "Fund Screener", "url": "/funds-screener/landing/"},
                    {"action_hint": "Open SIP Return Calculator screen", "component_code": null, "download_url": null, "icon": "/assets/images/hub_icon/sip_calculator.svg", "id": "sip_calculator", "is_ext_url": false, "products": null, "title": "SIP Calculator", "url": "/sip-calculator/"},
                    {"action_hint": "Browse stories and videos", "component_code": "STORIES_VIDEOS_PAGE", "download_url": null, "icon": "/assets/images/hub_icon/story_video.svg", "id": "story_video", "is_ext_url": false, "products": null, "title": "Stories & Videos", "url": "/stories/"}
                ],
                "title": "Mutual Funds"
            },
            {
                "id": "stocks",
                "menus": [
                    {"action_hint": "Open Market Monitor screen", "component_code": null, "download_url": null, "icon": "/assets/images/hub_icon/market_monitor.svg", "id": "market_monitor", "is_ext_url": false, "products": null, "title": "Market Monitor", "url": "/stocks/"},